Proposal_ID,Title,Novelty_Score,Funding_Score,Feasibility_Score,Coal_Relevance_Score,Evaluation_Score
N003,Reinforcement Learning in Robotics,0.72692275,0.22222222222222232,0.05454545454545454,0.03571428571428571,0.3532654926856015
N002,Blockchain for Supply Chain Management,0.7534248,0.11111111111111116,0.03636363636363636,0.0,0.33086488476907366
N005,Quantum Computing Algorithms,0.7850919,0.0,0.01818181818181818,0.0,0.31767312039028517
N001,Deep Learning for Medical Imaging,0.6523575,0.0,0.01818181818181818,0.0,0.26457938898693434
N004,Computer Vision for Autonomous Vehicles,0.54216856,0.0,0.03636363636363636,0.0,0.22414015927098013
